Lloyd Pellatt, Daniel Roggen	Fast Deep Neural Architecture Search for Wearable Activity Recognition by Early Prediction of Converged Performance.	2021	https://doi.org/10.1145/3460421.3478813
Marius Bock, Alexander Hölzemann, Michael Moeller, Kristof Van Laerhoven	Improving Deep Learning for HAR with Shallow LSTMs.	2021	https://doi.org/10.1145/3460421.3480419
Shruthi Kashinath Hiremath, Thomas Ploetz	On the Role of Context Length for Feature Extraction and Sequence Modeling in Human Activity Recognition.	2021	https://doi.org/10.1145/3460421.3478825
Paula Lago, Moe Matsuki, Kohei Adachi, Sozo Inoue	Using additional training sensors to improve single-sensor complex activity recognition.	2021	https://doi.org/10.1145/3460421.3480421
Setareh Rahimi Taghanaki, Michael J. Rainbow, Ali Etemad	Self-supervised Human Activity Recognition by Learning to Predict Cross-Dimensional Motion.	2021	https://doi.org/10.1145/3460421.3480417
Stefan Hermann, Paula Breitling, Tobias Röddiger, Michael Beigl	Cardiopulmonary Resuscitation Support: Comparison of Wrist-, Chest-, and Ear-Worn Devices and Estimation Algorithms.	2021	https://doi.org/10.1145/3460421.3478820
Nobuyuki Oishi, Benedetta Heimler, Lloyd Pellatt, Meir Plotnik, Daniel Roggen	Detecting Freezing of Gait with Earables Trained from VR Motion Capture Data.	2021	https://doi.org/10.1145/3460421.3478821
Steeven Villa, Jasmin Niess, Bettina Eska, Albrecht Schmidt, Tonja-Katrin Machulla	Assisting Motor Skill Transfer for Dance StudentsUsing Wearable Feedback.	2021	https://doi.org/10.1145/3460421.3478817
Nataliya Kosmyna, Chi-Yun Hu, Yujie Wang, Qiuxuan Wu, Cassandra Scheirer, Pattie Maes	A Pilot Study using Covert Visuospatial Attention as an EEG-based Brain Computer Interface to Enhance AR Interaction.	2021	https://doi.org/10.1145/3460421.3480420
Qing Zhang, Hiroo Yamamura, Holger Baldauf, Dingding Zheng, Kanyu Chen, Junichi Yamaoka, Kai Kunze	Tunnel Vision - Dynamic Peripheral Vision Blocking Glasses for Reducing Motion Sickness Symptoms.	2021	https://doi.org/10.1145/3460421.3478824
Mel Arthurs, José Juan Dominguez Veiga, Tomas E. Ward	Accurate Reaction Times on Smartphones: The Challenges of Developing a Mobile Psychomotor Vigilance Task.	2021	https://doi.org/10.1145/3460421.3478818
Kyosuke Futami, Tomoya Seki, Kazuya Murao	Mindless Load Changer: A Method for Manipulating Load Perception by Feedback of Myoelectricity Sensor Information.	2021	https://doi.org/10.1145/3460421.3478816
Kiichi Shirai, Kyosuke Futami, Kazuya Murao	A Method to Manipulate Subjective Time by using Tactile Stimuli of Wearable Device.	2021	https://doi.org/10.1145/3460421.3480932
Erik Pescara, Anton Stubenbord, Tobias Röddiger, Likun Fang, Michael Beigl	Where Should I Look? Comparing Reference Frames for Spatial Tactile Cues.	2021	https://doi.org/10.1145/3460421.3478822
Annalisa Baronetto, Lena Uhlenberg, Dominik Wassermann, Oliver Amft	Simulation of Garment-Embedded Contact Sensor Performance under Motion Dynamics.	2021	https://doi.org/10.1145/3460421.3480423
Hymalai Bello, Bo Zhou, Sungho Suh, Paul Lukowicz	MoCapaci: Posture and gesture detection in loose garments using textile cables as capacitive antennas.	2021	https://doi.org/10.1145/3460421.3480418
Seol-Yee Lee, Md. Tahmidul Islam Molla, Hsin-Liu Cindy Kao	A 10-Year Review of the Methods and Purposes of On-Skin Interface Research in ACM SIGCHI.	2021	https://doi.org/10.1145/3460421.3480424
Kunpeng Huang, Md. Tahmidul Islam Molla, Kat Roberts, Pin-Sung Ku, Aditi Galada, Hsin-Liu Cindy Kao	Delocalizing Strain in Interconnected Joints of On-Skin Interfaces.	2021	https://doi.org/10.1145/3460421.3478812
Suyash Junnarkar, Xiangyi (Lily) Yang, Morgan Drawdy, Inika Gupta, Woon-Hong Yeo, Noah Posner, Sang-won Leigh	Exploiting the Slowness of Electrochromic Displays.	2021	https://doi.org/10.1145/3460421.3480422
Florian Wolling, Cong Dat Huynh, Kristof Van Laerhoven	IBSync: Intra-body Synchronization of Wearable Devices Using Artificial ECG Landmarks.	2021	https://doi.org/10.1145/3460421.3478815
Rawan Alharbi, Chunlin Feng, Sougata Sen, Jayalakshmi Jain, Josiah D. Hester, Nabil Alshurafa	HeatSight: Wearable Low-power Omni Thermal Sensing.	2021	https://doi.org/10.1145/3460421.3478811
Juan Felipe Vargas, Bo Zhou, Hymalai Bello, Paul Lukowicz	Brainwear: Towards Multi-modal Garment Integrated EEG.	2021	https://doi.org/10.1145/3460421.3478814
Atsuhiro Fujii, Kazuya Murao, Naoji Matsuhisa	disp2ppg: Pulse Wave Generation to PPG Sensor using Display.	2021	https://doi.org/10.1145/3460421.3478823
David Kopyto, Rui Zhang, Oliver Amft	Audio-Based Onset Detection applied to Chewing Cycle Segmentation.	2021	https://doi.org/10.1145/3460421.3478819
Yang Bai, Yu Guan, Jian Qing Shi, Wan-Fai Ng	Towards Automated Fatigue Assessment using Wearable Sensing and Mixed-Effects Models.	2021	https://doi.org/10.1145/3460421.3480429
Behnam Behinaein, Anubhav Bhatti, Dirk Rodenburg, Paul Hungler, Ali Etemad	A Transformer Architecture for Stress Detection from ECG.	2021	https://doi.org/10.1145/3460421.3480427
Gijs Huisman, Tommaso Lisini Baldi, Nicole D'Aurizio, Domenico Prattichizzo	Feedback of Head Gestures in Audio-haptic Remote Communication.	2021	https://doi.org/10.1145/3460421.3478809
Kaito Isobe, Kazuya Murao	Person-identification Methodusing Active Acoustic Sensing Applied to Nose.	2021	https://doi.org/10.1145/3460421.3480425
Jeyeon Jo, Huiju Park	RFInsole: Batteryless Gait-Monitoring Smart Insole Based on Passive RFID Tags.	2021	https://doi.org/10.1145/3460421.3478810
Yuuki Nishino, Takuya Maekawa, Takahiro Hara	WeakCounter: Acceleration-based Repetition Counting of Actions with Weakly Supervised Learning.	2021	https://doi.org/10.1145/3460421.3480431
Masahiro Okamoto, Kazuya Murao	Estimating Upper Arm sEMG from Wrist PPG.	2021	https://doi.org/10.1145/3460421.3480430
Tobias Röddiger, Christian Dinse, Michael Beigl	Wearability and Comfort of Earables During Sleep.	2021	https://doi.org/10.1145/3460421.3480432
Alejandro Sánchez Guinea, Simon Heinrich, Max Mühlhäuser	VIDENS: Vision-based User Identification from Inertial Sensors.	2021	https://doi.org/10.1145/3460421.3480426
Jason Tu, Angeline Vidhula Jeyachandra, Deepthi Nagesh, Naresh Prabhu, Thad Starner	Typing on Tap: Estimating a Finger-Worn One-Handed Chording Keyboard's Text Entry Rate.	2021	https://doi.org/10.1145/3460421.3480428
Verindi Vekemans, Ward Leenders, Sijie Zhu, Rong-Hao Liang	MOTUS: Rendering Emotions with a Wrist-worn Tactile Display.	2021	https://doi.org/10.1145/3460421.3480390
Rain Ashford	Doki Doki: A Modular Wearable for Social Interaction in the COVID Era and Beyond.	2021	https://doi.org/10.1145/3460421.3478835
Damien Brun, Jonna Häkkilä	VäriWig: Interactive Coloring Wig Module.	2021	https://doi.org/10.1145/3460421.3478832
Crystal Compton, Heidi Woelfle, Bolanle O. Dahunsi, Robert MT Pettys-Baker, Niharikha Subash, Miles Priebe, Brad T. Holschuh	Dynamic, Discreet, Robotic Compression Garment for Real-Time Stress Assessment and Intervention.	2021	https://doi.org/10.1145/3460421.3478837
Hannah Friederike Fischer, Daniela Wittmann, Alejandro Baucells Costa, Bo Zhou, Gesche Joost, Paul Lukowicz	Masquare: A Functional Smart Mask Design for Health Monitoring.	2021	https://doi.org/10.1145/3460421.3478831
Alireza Golgouneh, Eric Beaudette, Heidi Woelfle, Bai Li, Niharikha Subash, Amanda J. Redhouse, Mark Jones, Tom L. Martin, Michele A. Lobo, Brad T. Holschuh, Lucy E. Dunne	Design of a Hybrid SMA-Pneumatic based Wearable Upper Limb Exoskeleton.	2021	https://doi.org/10.1145/3460421.3478838
Gozde Goncu Berk, Ruoyu Zhang, Cigdem Yilmaz	CalmWear: A Smart Tactile Sensory Stimulation Clothing.	2021	https://doi.org/10.1145/3460421.3478829
Jeyeon Jo, Doyeon Kong, Huiju Park	BLInG: Beads-Laden Interactive Garment.	2021	https://doi.org/10.1145/3460421.3478827
Kathleen McDermott, Bo Byun, Ash Tiwari, Amy Hu	Solar Scarf: Expanding DIY educational content with an expressive wearable system.	2021	https://doi.org/10.1145/3460421.3478830
Galina Mihaleva, Fok-Chi-Seng Fok Kow	Development of an Aesthetic for a Stroke Rehabilitation System.	2021	https://doi.org/10.1145/3460421.3478828
Robert MT Pettys-Baker, Heidi Woelfle, Saji Antonio Fernandes, Isidora Mack, Lucy E. Dunne	User-Controlled Multi-Zone Jacket for Thermal Microclimate Regulation.	2021	https://doi.org/10.1145/3460421.3478834
Sima Pirmoradi, Beth Ferguson, Gozde Goncu Berk, Katia Vega	CJ-2050: Body Cooling Wearable Technology.	2021	https://doi.org/10.1145/3460421.3478826
Afroditi Psarra, Sadaf Sadri, Esteban Agosin, Grace Barar, Rylie Sweem, Cindy Xu, Ruoxi Song, Zoe Kaputa	Sensing Textures: Tactile Resistance.	2021	https://doi.org/10.1145/3460421.3478833
Daniela Wittmann, Hannah Friederike Fischer, Tiago Martins, Gesche Joost	TheraTrousers: Reactive wearable for playful therapeutic self-empowerment: Wearable for Therapeutic Exercising.	2021	https://doi.org/10.1145/3460421.3478840
