Aakriti Adhikari, Sanjib Sur	MilliPose: Facilitating Full Body Silhouette Imaging from Millimeter-Wave Device.	2021	https://doi.org/10.1145/3460418.3479281
Sizhen Bian, Paul Lukowicz	Capacitive Sensing Based On-board Hand Gesture Recognition with TinyML.	2021	https://doi.org/10.1145/3460418.3479287
Pingping Cai, Edward M. Sitar, Sanjib Sur	AutoPCD: Learning-Augmented Indoor Point Cloud Completion.	2021	https://doi.org/10.1145/3460418.3479309
Chung Chiao Chang, Meng-Hsin Wu, Yu-Jen Lee, Xi-Jing Chang, Yung-Ju Chang	Opportune Moments for the Multi-Stage Notification Responding Process: A Preliminary Investigation.	2021	https://doi.org/10.1145/3460418.3479278
Yang Chen, Zhitong Cui, Ching Chiuan Yen	Demo: Chewpin: a wearable acoustic device for chewing detection.	2021	https://doi.org/10.1145/3460418.3479290
Jian-Hua Jiang Chen, Ming Yen Yeh, Chen-Chin Lin, Yung-Ju Chang, Wan-Yun Yu, Rebecca Ping Yu	Occurrence and Triggers of Mobile News Exposure: A Screenshot-Based ESM Study.	2021	https://doi.org/10.1145/3460418.3479291
Yu-Chun Chen, Keui-Chun Kao, Yu-Jen Lee, Faye Shih, Wei-Chen Chiu, Yung-Ju Chang	Killing-Time Detection from Smartphone Screenshots.	2021	https://doi.org/10.1145/3460418.3479295
Pin-Chieh Chen, Min-Wei Hung, Hsueh-Sung Lu, Tina Chien-Wen Yuan, Nanyi Bi, Wan-Chen Lee, Ming-Chyi Huang, Chuang-Wen You	TechLifeProbe: A Technology Prototype to Probe How Data Sharing With Adolescents' Parents Improves Their Technology Abuse Through Mobile Phones.	2021	https://doi.org/10.1145/3460418.3479297
Xuefu Dong, Zengyi Han, Yuuki Nishiyama, Kaoru Sezaki	Detecting Single-Hand Riding with Integrated Accelerometer and Gyroscope of Smartphone.	2021	https://doi.org/10.1145/3460418.3479294
Andrei Furdui, Tianyi Zhang, Marcel Worring, Pablo César, Abdallah El Ali	AC-WGAN-GP: Augmenting ECG and GSR Signals using Conditional Generative Models for Arousal Classification.	2021	https://doi.org/10.1145/3460418.3479301
Hristijan Gjoreski, Ifigeneia I. Mavridou, Mohsen Fatoorechi, Ivana Kiprijanovska, Martin Gjoreski, Graeme Cox, Charles Nduka	emteqPRO: Face-mounted Mask for Emotion Recognition and Affective Computing.	2021	https://doi.org/10.1145/3460418.3479276
Zengyi Han, Xuefu Dong, Yuuki Nishiyama, Kaoru Sezaki	HeadSense: A Head Movement Detecting System for Micro-Mobility Riders.	2021	https://doi.org/10.1145/3460418.3479282
Hirotaka Hayashi, Anran Xu, Zhongyi Zhou, Koji Yatani	Vision-based Scene Analysis toward Dangerous Cycling Behavior Detection Using Smartphones.	2021	https://doi.org/10.1145/3460418.3479300
Takamasa Higuchi, Kentaro Oguchi	On the Predictability of Parking Preferences.	2021	https://doi.org/10.1145/3460418.3479273
Ping-Ju Huang, Chia-Chen Wu, Yu-Hsin Lai, Chen-Chin Lin, Yung-Ju Chang	Poster: I'm Interested, but Can/Would Only Skim It: Studying Smartphone Users' Receptivity to News Notifications.	2021	https://doi.org/10.1145/3460418.3479292
Min-Wei Hung, Chi-Ting Hou, Chieh-Jui Ho, Hsueh-Sung Lu, Tina Chien-Wen Yuan, Nanyi Bi, Shu-Wei Liu, Ming-Chyi Huang, Chuang-Wen You	Challenges and Opportunities in Developing Systems to Assist Patients in Recovering from Gambling Addiction.	2021	https://doi.org/10.1145/3460418.3479298
Yuji Kanamitsu, Koki Tachibana, Yugo Nakamura, Yuki Matsuda, Hirohiko Suwa, Keiichi Yasumoto	Using Interaction as Nudge to Increase Installation Rate of COVID-19 Contact-Confirming Application.	2021	https://doi.org/10.1145/3460418.3479284
Soowon Kang, Heepyung Kim, Youngtae Noh, Uichin Lee	Poster: Toward Context-aware Proactive Conversation for Smart Speakers.	2021	https://doi.org/10.1145/3460418.3479306
Inyeop Kim, Hwarang Goh, Youngtae Noh, Uichin Lee	Poster: Exploring User Contexts and Needs for Context-aware Smartphone Distraction Management.	2021	https://doi.org/10.1145/3460418.3479307
Eiji Kumakawa, Wataru Yamada, Keiichi Ochiai, Yusuke Fukazawa, Mizuki Shirai, Hirokazu Masuda	Estimating Patient Independence with Sleep Sensors.	2021	https://doi.org/10.1145/3460418.3479308
Yuyu Lee, Kai Kunze	Poster: A Participatory Workshop to Design Vibrothermal Haptics of a Smart Fidget Surface for Remote Workers.	2021	https://doi.org/10.1145/3460418.3479279
Woojin Lee, Balsam Alkouz, Babar Shahzaad, Athman Bouguettaya	Package Delivery Using Autonomous Drones in Skyways.	2021	https://doi.org/10.1145/3460418.3479289
Yugo Nakamura	IoT Nudge: IoT Data-driven Nudging for Health Behavior Change.	2021	https://doi.org/10.1145/3460418.3479280
Yuuki Nishiyama, Kaoru Sezaki	Experience Sampling Tool for Repetitive Skills Training in Sports using Voice User Interface.	2021	https://doi.org/10.1145/3460418.3479283
Adam Nowak, Yuchong Zhang, Andrzej Romanowski, Morten Fjeld	Augmented Reality with Industrial Process Tomography: To Support Complex Data Analysis in 3D Space.	2021	https://doi.org/10.1145/3460418.3479288
Tsuyoshi Okita	Activity Simulation from Signals.	2021	https://doi.org/10.1145/3460418.3479275
Thomas Pönitz, Gerhard Ebenhofer, Gernot Stübl, Christoph Heindl, Josef Scharinger	On the Potential of Large-scale Extended Reality Interaction for Industrial Environments.	2021	https://doi.org/10.1145/3460418.3479304
Naik Bakht Sania Qureshi, Dong-Hoon Kim, Jiwoo Lee, Eun-Kyu Lee	On the Performance Impact of Poisoning Attacks on Load Forecasting in Federated Learning.	2021	https://doi.org/10.1145/3460418.3479285
Federica Rollo, Bharath Sudharsan, Laura Po, John G. Breslin	Air Quality Sensor Network Data Acquisition, Cleaning, Visualization, and Analytics: A Real-world IoT Use Case.	2021	https://doi.org/10.1145/3460418.3479277
Jacqueline M. Schellberg, Sanjib Sur	ViSAR: A Mobile Platform for Vision-Integrated Millimeter-Wave Synthetic Aperture Radar.	2021	https://doi.org/10.1145/3460418.3479310
Chen Shi, Zengming Zhang, Feijun Jiang, Yuxiang Hu	Adaptor: A Real-time Module for a Conversational Agent to Adapt Policy Based on Negative User Behavior.	2021	https://doi.org/10.1145/3460418.3479274
Masami Takahashi, Masahiro Kohjima, Ryo Hashimoto, Asuka Miyake, Takeshi Kurashima, Hiroyuki Toda	Effects of Intervening Backwards from Goals to Improve Sleep Habits.	2021	https://doi.org/10.1145/3460418.3479305
Seiya Tanaka, Andrew W. Vargo, Motoi Iwata, Koichi Kise	Confidence Estimation via Wrist Movement.	2021	https://doi.org/10.1145/3460418.3479286
Shang-Chi Tu, Pei-Yi (Patricia) Kuo	AudioMomento.	2021	https://doi.org/10.1145/3460418.3479302
Yan Wang, Zhuying Li, Rohit Ashok Khot, Florian 'Floyd' Mueller	Sonic Straws: A beverage-based playful gustosonic system.	2021	https://doi.org/10.1145/3460418.3479293
Aslan B. Wong, Xia Chen, Hao Ren, Usman Saleh Toro, Kaishun Wu	Toward Speech Articulation Detection through Smartphone.	2021	https://doi.org/10.1145/3460418.3479299
Ge-Han Wu, Ling-Jun Liu, Yu-Hsuan Tseng, Yung-Han Kao, Fu-En Wang	DillyDally: Overcome Your Procrastination via Social Network.	2021	https://doi.org/10.1145/3460418.3479296
Zhongyi Zhai, Xiaofeng Chen, Yinduo Zhao, Lingzhong Zhao, Junyan Qian, Jinsong Wu	SmartCamera: Realtime Video Stream-Oriented Action Recognition Platform in Edge Environment.	2021	https://doi.org/10.1145/3460418.3479303
Ekene Attoh, Beat Signer	A Middleware for Implicit Human-Computer Interaction Across IoT Platforms.	2021	https://doi.org/10.1145/3460418.3479311
Johnna Blair	Designing for Serious Mental Illnesses: Enabling Early Detection and Supporting Financial Wellbeing in Bipolar Disorder.	2021	https://doi.org/10.1145/3460418.3479312
Jonas Doese, Torben Weis	Towards Explainability of non-Convolutional Neural Networks.	2021	https://doi.org/10.1145/3460418.3479313
Matthias Schaffeld, Torben Weis	Towards Robust Models of Cyber-Physical Systems.	2021	https://doi.org/10.1145/3460418.3479314
Tadashi Okoshi, Jin Nakazawa, Jeong-Gil Ko, Fahim Kawsar, Susanna Pirttikangas	WellComp 2021: Fourth International Workshop on Computing for Well-Being.	2021	https://doi.org/10.1145/3460418.3479262
Constantino Álvarez Casado, Petteri Paananen, Pekka Siirtola, Susanna Pirttikangas, Miguel Bordallo López	Meditation Detection Using Sensors from Wearable Devices.	2021	https://doi.org/10.1145/3460418.3479318
Satoki Hamanaka, Wataru Sasaki, Tadashi Okoshi, Jin Nakazawa, Kaori Yagasaki, Hiroko Komatsu	A Comparative Study of CIPN Symptom Estimation Methods Based on Machine Learning.	2021	https://doi.org/10.1145/3460418.3479316
Lam Huynh, Tri Nguyen, Thu Nguyen, Susanna Pirttikangas, Pekka Siirtola	StressNAS: Affect State and Stress Detection Using Neural Architecture Search.	2021	https://doi.org/10.1145/3460418.3479320
Yusuke Kawasaki, Tahera Hossain, Anna Yokokubo, Guillaume Lopez	Estimating the Degree of Mental State using Heart Rate while Studying.	2021	https://doi.org/10.1145/3460418.3479317
Aarathi Prasad, Lucas S. LaFreniere, Vaasu Taneja, Zoe Beals	Addressing Problematic Smartphone Use with a Personalized, Goal-based Approach.	2021	https://doi.org/10.1145/3460418.3479319
Fahim Kawsar, Robert Harle, Alessandro Montanari, Chulhong Min	EarComp 2021: Second International Workshop on Earable Computing.	2021	https://doi.org/10.1145/3460418.3479263
Ashwin Ahuja, Andrea Ferlini, Cecilia Mascolo	PilotEar: Enabling In-ear Inertial Navigation.	2021	https://doi.org/10.1145/3460418.3479326
Erika Bondareva, Elín Rós Hauksdóttir, Cecilia Mascolo	Earables for Detection of Bruxism: a Feasibility Study.	2021	https://doi.org/10.1145/3460418.3479327
Matija Franklin, David A. Lagnado, Chulhong Min, Akhil Mathur, Fahim Kawsar	Designing Memory Aids for Dementia Patients using Earables.	2021	https://doi.org/10.1145/3460418.3479324
Dongwoo Kim, Chulhong Min, Seungwoo Kang	Towards Automatic Recognition of Perceived Level of Understanding on Online Lectures using Earables.	2021	https://doi.org/10.1145/3460418.3479323
Matías Laporte, Preety Baglat, Shkurta Gashi, Martin Gjoreski, Silvia Santini, Marc Langheinrich	Detecting Verbal and Non-Verbal Gestures Using Earables.	2021	https://doi.org/10.1145/3460418.3479322
Swati Mandekar, Lina Jentsch, Kai Lutz, Mehdi Behbahani, Mark Melnykowycz	Earable Design Analysis for Sleep EEG Measurements.	2021	https://doi.org/10.1145/3460418.3479328
Nishiki Motokawa, Ami Jinno, Yushi Takayama, Shun Ishii, Anna Yokokubo, Guillaume Lopez	Coremoni-WE: Individual Core Training Monitoring and Support System Using an IMU at the Waist and the Ear.	2021	https://doi.org/10.1145/3460418.3479325
Yushi Takayama, Shun Ishii, Anna Yokokubo, Guillaume Lopez	Detecting forward leaning posture using eSense and developing a posture improvement promoting system.	2021	https://doi.org/10.1145/3460418.3479321
Haibin Zhao, Tobias Röddiger, Michael Beigl	AirCase: Earable Charging Case with Air Quality Monitoring and Soundscape Sonification.	2021	https://doi.org/10.1145/3460418.3479329
Varun Mishra, Akane Sano, Sahiti Kunchay, Saeed Abdullah, Jakob E. Bardram, Elizabeth L. Murnane, Tanzeem Choudhury, Mirco Musolesi, Giovanna Nunes Vilaza, Rajalakshmi Nandakumar, Tauhidur Rahman	6th International Workshop on Mental Health and Well-being: Sensing and Intervention.	2021	https://doi.org/10.1145/3460418.3479264
Eduardo Coutinho, Ayesh Alshukri, Jacopo de Berardinis, Chris Dowrick	POLYHYMNIA Mood - Empowering people to cope with depression through music listening.	2021	https://doi.org/10.1145/3460418.3479334
Stanley Goffinet, Donatien Schmitz, Igor Zavalyshyn, Axel Legay, Etienne Riviere	Controlling Security Rules Using Natural Dialogue: an Application to Smart Home Care.	2021	https://doi.org/10.1145/3460418.3479331
Hee Jeong Han, Sanjana Mendu, Beth K. Jaworski, Jason E. Owen, Saeed Abdullah	PTSDialogue: Designing a Conversational Agent to Support Individuals with Post-Traumatic Stress Disorder.	2021	https://doi.org/10.1145/3460418.3479332
JaeWon Kim, Yuri Kim, Yuna Jeong, Youngki Lee	Fullproof: Towards the Detection of Impostor Syndrome Using Smartphone Sensors.	2021	https://doi.org/10.1145/3460418.3479333
Ling Qiu, Saeed Abdullah	Voice Assistants for Speech Therapy.	2021	https://doi.org/10.1145/3460418.3479336
Jaakko Tervonen, Johanna Närväinen, Jani Mäntyjärvi, Kati Pettersson	In Search of Harmful Stress.	2021	https://doi.org/10.1145/3460418.3479335
Helma Torkamaan, Jürgen Ziegler	Integrating Behavior Change and Persuasive Design Theories into an Example Mobile Health Recommender System.	2021	https://doi.org/10.1145/3460418.3479330
Benjamin Tag, Sarah Webber, Greg Wadley, Vanessa Bartlett, Jorge Gonçalves, Peter Koval, Petr Slovák, Wally Smith, Tom Hollenstein, Anna L. Cox, Vassilis Kostakos	Making Sense of Emotion-Sensing: Workshop on Quantifying Human Emotions.	2021	https://doi.org/10.1145/3460418.3479272
Eylül Ertay, Hao Huang, Zhanna Sarsenbayeva, Tilman Dingler	Challenges of Emotion Detection Using Facial Expressions and Emotion Visualisation in Remote Communication.	2021	https://doi.org/10.1145/3460418.3479341
Nan Gao, Mohammad Saiedur Rahaman, Wei Shao, Flora D. Salim	Investigating the Reliability of Self-report Data in the Wild: The Quest for Ground Truth.	2021	https://doi.org/10.1145/3460418.3479338
Vivian Genaro Motti	Towards a Design Space for Emotion Recognition.	2021	https://doi.org/10.1145/3460418.3479337
Hannah R. Nolasco, Matthew Waldman, Andrew W. Vargo	Exploring Emotional Reappraisal and Repression through Acoustic Mood Self-Tracking.	2021	https://doi.org/10.1145/3460418.3479340
Tyne Daile Sumner	False Face Must Hide What the False Heart Doth Know: : The Literary Face in the Age of AI.	2021	https://doi.org/10.1145/3460418.3479339
Nadine Wagener, Jasmin Niess	Reflecting on Emotions within VR Mood Worlds.	2021	https://doi.org/10.1145/3460418.3479342
Chris Norval, Richard Cloete, Milan Markovic, Iman Naja, Kristin B. Cornelius	Workshop on Reviewable and Auditable Pervasive Systems (WRAPS).	2021	https://doi.org/10.1145/3460418.3479265
Iain Barclay, Will Abramson	Identifying Roles, Requirements and Responsibilitiesin Trustworthy AI Systems.	2021	https://doi.org/10.1145/3460418.3479344
Judith Faßbender	Particles of a Whole: Design Patterns for Transparent and Auditable AI-Systems.	2021	https://doi.org/10.1145/3460418.3479345
Zoe Zwiebelmann, Tristan Henderson	Data Portability as a Tool for Audit.	2021	https://doi.org/10.1145/3460418.3479343
Kazuya Murao, Yu Enokibori, Hristijan Gjoreski, Paula Lago, Tsuyoshi Okita, Pekka Siirtola, Kei Hiroi, Philipp M. Scholl, Mathias Ciliberto, Kenta Urano	9th International Workshop on Human Activity Sensing Corpus and Applications (HASCA).	2021	https://doi.org/10.1145/3460418.3479266
Sayeda Shamma Alia, Tahera Hossain, Sozo Inoue	PerMML: A Performance Metric for Multi-layer Dataset.	2021	https://doi.org/10.1145/3460418.3479352
Mathias Ciliberto, Luis Alejandro Ponce Cuspinera, Daniel Roggen	Collecting a Dataset of Gestures for Skill Assessment in the Field: a beach volleyball serves case study.	2021	https://doi.org/10.1145/3460418.3479355
Leonardo Azael García-García, George Valsamakis, Paul Kreitmair, Niko Münzenrieder, Daniel Roggen	Inferring Complex Textile Shape from an Integrated Carbon Black-infused Ecoflex-based Bend and Stretch Sensor Array.	2021	https://doi.org/10.1145/3460418.3479347
Haruka Kamachi, Tahera Hossain, Fuyuka Tokuyama, Anna Yokokubo, Guillaume Lopez	Prediction of Eating Activity using Smartwatch.	2021	https://doi.org/10.1145/3460418.3479348
Haruka Kamachi, Takumi Kondo, Tahera Hossain, Anna Yokokubo, Guillaume Lopez	Automatic Segmentation Method of Bone Conduction Sound for Eating Activity Detailed Detection.	2021	https://doi.org/10.1145/3460418.3479353
Haru Kaneko, Tahera Hossain, Sozo Inoue	Analysis of Feature Importances for Automatic Generation of Care Records.	2021	https://doi.org/10.1145/3460418.3479354
Hiroki Kato, Yu Enokibori, Naoto Yoshida, Kenji Mase	Toward Fine-Grained Sleeping Activity Recognition: 3d Extension and an Estimation Try on Joint Position of SLP Dataset.	2021	https://doi.org/10.1145/3460418.3479349
Joseph Korpela, Takayuki Akiyama, Takehiro Niikura, Katsuyuki Nakamura	Reducing Label Fragmentation During Time-series Data Annotation to Reduce Annotation Costs.	2021	https://doi.org/10.1145/3460418.3479350
Yuki Toyosaka, Tsuyoshi Okita	Activity Knowledge Graph Recognition by Eye Gaze: Identification of Distant Object in Eye Sight for Watch Activity.	2021	https://doi.org/10.1145/3460418.3479351
Safaeid Hossain Arib, Rabeya Akter, Omar Shahid, Md Atiqur Rahman Ahad	Classical Machine Learning Approach for Human Activity Recognition Using Location Data.	2021	https://doi.org/10.1145/3460418.3479376
Dmitrijs Balabka, Denys Shkliarenko	Human activity recognition with AutoML using smartphone radio data.	2021	https://doi.org/10.1145/3460418.3479377
Promit Basak, Shahamat Mustavi Tasin, A. H. M. Nazmus Sakib, Syed Doha Uddin, Md Atiqur Rahman Ahad	A Windowless Approach to Recognize Various Modes of Locomotion and Transportation.	2021	https://doi.org/10.1145/3460418.3479385
Gulustan Dogan, Jonathan Daniel Sturdivant, Seyda Ari, Evan Kurpiewski	Locomotion-Transportation Recognition via LSTM and GPS Derived Feature Engineering from Cell Phone Data.	2021	https://doi.org/10.1145/3460418.3479379
Livii Iabanzhi, Maria Astrakhan, Pavlo Tyshevskyi	Location-based Human Activity Recognition Using Long-term Deep Learning Invariant Mapping.	2021	https://doi.org/10.1145/3460418.3479381
Ryoichi Kojima, Roberto Legaspi, Yutaro Mishima, Shinya Wada	Classical machine learning and deep neural network ensemble model for GPS-based activity recognition.	2021	https://doi.org/10.1145/3460418.3479386
Nhat-Tan Le, Nazmun Nahid, Sozo Inoue	Transition-points-based Segmentation and Hierarchical Classification for Locomotion and Transportation recognition on Radio-data.	2021	https://doi.org/10.1145/3460418.3479380
Chuankun Li, Shuai Li, Yanbo Gao, Jinming Guo, Ping Chen, Wanqing Li	Dense CNN and IndRNN for the Sussex-Huawei Locomotion-Transportation Recognition Challenge.	2021	https://doi.org/10.1145/3460418.3479378
Yan Ren	Multiple Tree Model Integration for Transportation Mode Recognition.	2021	https://doi.org/10.1145/3460418.3479372
Purnata Saha, Md. Morshed Alam, Malisha Islam Tapotee, Sriman Bidhan Baray, Md Atiqur Rahman Ahad	An Empirical Approach for Human Locomotion and Transportation Recognition from Radio Data.	2021	https://doi.org/10.1145/3460418.3479384
Ryoichi Sekiguchi, Kenji Abe, Shogo Suzuki, Masayasu Kumano, Daisuke Asakura, Ryo Okabe, Takeru Kariya, Masaki Kawakatsu	Phased Human Activity Recognition based on GPS.	2021	https://doi.org/10.1145/3460418.3479382
Jinhua Su, Yuanyuan Zhang	Triple-O for SHL Recognition Challenge: An Ensemble Framework for Multi-class Imbalance and Training-testing Distribution Inconsistency by OvO Binarization with Confidence Weight of One-class Classification.	2021	https://doi.org/10.1145/3460418.3479375
Aosheng Tian, Ye Zhang, Huiling Chen, Chao Ma, Shilin Zhou	An Ensemble of ConvTransformer Networks for the Sussex-Huawei Locomotion-Transportation (SHL) Recognition Challenge.	2021	https://doi.org/10.1145/3460418.3479383
Lin Wang, Mathias Ciliberto, Hristijan Gjoreski, Paula Lago, Kazuya Murao, Tsuyoshi Okita, Daniel Roggen	Locomotion and Transportation Mode Recognition from GPS and Radio Signals: Summary of SHL Challenge 2021.	2021	https://doi.org/10.1145/3460418.3479373
Yida Zhu, Haiyong Luo, Song Guo, Fang Zhao	Data Mining for Transportation Mode Recognition from Radio-data.	2021	https://doi.org/10.1145/3460418.3479374
Sayeda Shamma Alia, Kohei Adachi, Tahera Hossain, Nhat-Tan Le, Haru Kaneko, Paula Lago, Tsuyoshi Okita, Sozo Inoue	Summary of the Third Nurse Care Activity Recognition Challenge - Can We Do from the Field Data?	2021	https://doi.org/10.1145/3460418.3479391
M. Ashikuzzaman Kowshik, Yeasin Arafat Pritom, Md. Sohanur Rahman, Ali Akbar, Md Atiqur Rahman Ahad	Nurse Care Activity Recognition from Accelerometer Sensor Data Using Fourier- and Wavelet-based Features.	2021	https://doi.org/10.1145/3460418.3479387
Arafat Rahman, Iqbal Hassan, Md Atiqur Rahman Ahad	Nurse Care Activity Recognition: A Cost-Sensitive Ensemble Approach to Handle Imbalanced Class Problem in the Wild.	2021	https://doi.org/10.1145/3460418.3479389
Faizul Rakib Sayem, Md. Mamun Sheikh, Md Atiqur Rahman Ahad	Feature-based Method for Nurse Care Complex Activity Recognition from Accelerometer Sensor.	2021	https://doi.org/10.1145/3460418.3479388
Zubair Rahman Tusar, Maksuda Islam, Sadia Sharmin	Accelerometer based Complex Nurse Care Activity Recognition using Machine Learning Approach.	2021	https://doi.org/10.1145/3460418.3479390
Kirill Ragozin, Kai Kunze, Teresa Hirzle, Benjamin Tag, Yuji Uema, Enrico Rukzio, Jamie A. Ward	Eyewear 2021 The Forth Workshop on Eyewear Computing - Augmenting Social Situations and Democratizing Tools.	2021	https://doi.org/10.1145/3460418.3479267
James O. Campbell, Vincent Ta, Álvaro Cassinelli, Damien Rompapas	Project Ariel: An Open Source Augmented Reality Headset for Industrial Applications.	2021	https://doi.org/10.1145/3460418.3479359
David Dzsotjan, Kim Ludwig-Petsch, Sergey Mukhametov, Shoya Ishimaru, Stefan Küchemann, Jochen Kuhn	The Predictive Power of Eye-Tracking Data in an Interactive AR Learning Environment.	2021	https://doi.org/10.1145/3460418.3479358
Christopher Changmok Kim, Jiawen Han, Dingding Zheng, George Chernyshov, Kai Kunze	Using Smart Eyewear to Sense Electrodermal Activity While Reading.	2021	https://doi.org/10.1145/3460418.3479356
Denys J. C. Matthies, Alex Woodall, Bodo Urban	Prototyping Smart Eyewear with Capacitive Sensing for Facial and Head Gesture Detection.	2021	https://doi.org/10.1145/3460418.3479361
Sungmin Moon, Chao Zhang, Sooill Park, Hui Zhang, Woo-Shik Kim, Jong Hwan Ko	A Sub-Milliwatt and Sub-Millisecond 3-D Gaze Estimator for Ultra Low-Power AR Applications.	2021	https://doi.org/10.1145/3460418.3479360
Pramod Vadiraja, Jayasankar Santhosh, Hanane Moulay, Andreas Dengel, Shoya Ishimaru	Effects of Counting Seconds in the Mind while Reading.	2021	https://doi.org/10.1145/3460418.3479357
Himanshu Verma, Marios Constantinides, Sailin Zhong, Abdallah El Ali, Hamed S. Alavi	SensiBlend: Sensing Blended Experiences in Professional and Social Contexts.	2021	https://doi.org/10.1145/3460418.3479268
Alejandra Gomez Ortega, Jacky Bourgeois, Gerd Kortuem	Towards Designerly Data Donation.	2021	https://doi.org/10.1145/3460418.3479362
Raphael Tackx, Leo Blondel, Marc Santolini	Quantified Us: a group-in-the-loop approach to team network reconstruction.	2021	https://doi.org/10.1145/3460418.3479363
Diogo Branco, Patrick Carrington, Silvia Del Din, Afsaneh Doryab, Hristijan Gjoreski, Tiago João Vieira Guerreiro, Roisin McNaney, Kyle Montague, Alisha Pradhan, André Rodrigues, Julio Vega	Wild by Design: Workshop on Designing Ubiquitous Health Monitoring Technologies for Challenging Environments.	2021	https://doi.org/10.1145/3460418.3479271
Luís P. Carvalho, Daniel Jackson, Tiago João Vieira Guerreiro, Yu Guan, Kyle Montague	Participatory Action Research and Open Source Hardware Appropriation for Large Scale In-The-Wild Studies.	2021	https://doi.org/10.1145/3460418.3479369
Ana Cholakoska, Bjarne Pfitzner, Hristijan Gjoreski, Valentin Rakovic, Bert Arnrich, Marija Kalendar	Differentially Private Federated Learningfor Anomaly Detection in eHealth Networks.	2021	https://doi.org/10.1145/3460418.3479365
Graham Coulby, Adrian K. Clear, Oliver Jones, Alan Godfrey	IoT in the Wild: An expedition of discovery for remote monitoring.	2021	https://doi.org/10.1145/3460418.3479364
Erik Dovgan, Jakob Valic, Gasper Slapnicar, Mitja Lustrek	Recognition of Behaviour Patterns for People with Profound Intellectual and Multiple Disabilities.	2021	https://doi.org/10.1145/3460418.3479370
Junos Lukan, Larissa Bolliger, Els Clays, Oscar Mayora, Venet Osmani, Mitja Lustrek	Participants' Experience and Adherence in Repeated Measurement Studies Among Office-Based Workers.	2021	https://doi.org/10.1145/3460418.3479367
Ella Peltonen, Vappu Schroderus, Parsa Sharmila	Challenges on Collecting Smartphone Data in Cold Environments.	2021	https://doi.org/10.1145/3460418.3479368
Jay Rainey, David Verweij, Colin Dodds, Johanna Graeber, Farzaneh Farhadi, Ridita Ali, Viana Zhang, Christopher N. Bull, Jan David Smeddinck	Data Contribution Summaries for Patient Engagement in Multi-Device Health Monitoring Research.	2021	https://doi.org/10.1145/3460418.3479371
André Rodrigues, André R. B. Santos, Kyle Montague, Hugo Nicolau, Tiago João Guerreiro	WildKey: A Privacy-Aware Keyboard Toolkit for Data Collection In-The-Wild.	2021	https://doi.org/10.1145/3460418.3482872
Chuang-Wen You, Yi-Chao Chen, Hsin-Ruey Tsai, Bin Sheng	The First Workshop on Multiple Input Modalities and Sensations for VR/AR Interactions (MIMSVAI).	2021	https://doi.org/10.1145/3460418.3479269
Hao-Ping Chien, Ming Cheng Wu, Chun-Cheng Hsu	Flowing-Haptic Sleeve: Research on Apparent Tactile Motion Applied to Simulating the Feeling of Flow on the Arm.	2021	https://doi.org/10.1145/3460418.3480158
Chieh-Jui Ho, Chi-Ting Hou, Min-Wei Hung, Tina Chien-Wen Yuan, Nanyi Bi, Ming-Chyi Huang, Chuang-Wen You	CravingProbe: A System Combining Virtual Reality and Biofeedback Technologies to Assist Drug Psychotherapy.	2021	https://doi.org/10.1145/3460418.3480159
Hsuan-Yu Hsueh, Chien-Hua Chen, Irene Chen, Chih-Yuan Yao, Hung-Kuo Chu	ARToken: A Tangible Device for Dynamically Binding Real-world Objects with Virtual Representation.	2021	https://doi.org/10.1145/3460418.3480161
Sosuke Ichihashi, Arata Horie, Masaharu Hirose, Zendai Kashino, Shigeo Yoshida, Masahiko Inami	High-Speed Non-Contact Thermal Display Using Infrared Rays and Shutter Mechanism.	2021	https://doi.org/10.1145/3460418.3480160
Anton Nijholt	Experiencing Social Augmented Reality in Public Spaces.	2021	https://doi.org/10.1145/3460418.3480157
Yezhou Wang, Runting Zhang, Haonan Wu, Guangtao Xue	Material Identification System with Sound Simulation Assisted Method in VR/AR Scenarios.	2021	https://doi.org/10.1145/3460418.3480162
