Guansong Pang, Longbing Cao, Charu Aggarwal	Deep Learning for Anomaly Detection: Challenges, Methods, and Opportunities.	2021	https://doi.org/10.1145/3437963.3441659
Nihar B. Shah	WSDM 2021 Tutorial on Systematic Challenges and Computational Solutions on Bias and Unfairness in Peer Review.	2021	https://doi.org/10.1145/3437963.3441660
Zuohui Fu, Yikun Xian, Yongfeng Zhang, Yi Zhang	WSDM 2021 Tutorial on Conversational Recommendation Systems.	2021	https://doi.org/10.1145/3437963.3441661
Liang Pang, Qingyao Ai, Jun Xu	Beyond Probability Ranking Principle: Modeling the Dependencies among Documents.	2021	https://doi.org/10.1145/3437963.3441662
Da Zheng, Minjie Wang, Quan Gan, Xiang Song, Zheng Zhang, George Karypis	Scalable Graph Neural Networks with Deep Graph Library.	2021	https://doi.org/10.1145/3437963.3441663
Simon Razniewski, Niket Tandon, Aparna S. Varde	Information to Wisdom: Commonsense Knowledge Extraction and Compilation.	2021	https://doi.org/10.1145/3437963.3441664
Ludovico Boratto, Mirko Marras	Advances in Bias-aware Recommendation on the Web.	2021	https://doi.org/10.1145/3437963.3441665
Arjun Gopalan, Da-Cheng Juan, Cesar Ilharco Magalhaes, Chun-Sung Ferng, Allan Heydon, Chun-Ta Lu, Philip Pham, George Yu, Yicheng Fan, Yueqi Wang	Neural Structured Learning: Training Neural Networks with Structured Signals.	2021	https://doi.org/10.1145/3437963.3441666
Andrew Yates, Rodrigo Nogueira, Jimmy Lin	Pretrained Transformers for Text Ranking: BERT and Beyond.	2021	https://doi.org/10.1145/3437963.3441667
Tsvi Kuflik, Catalin-Mihai Barbu, Amra Delic, Dmitri Goldenberg, Julia Neidhardt, Ludovik Coba, Markus Zanker	WebTour 2021 Workshop on Web Tourism.	2021	https://doi.org/10.1145/3437963.3441836
Lluis Garcia Pueyo, Anand Bhaskar, Roelof van Zwol, Timos Sellis, Gireeja Ranade, Prathyusha Senthil Kumar, Yu Sun, Joy Zhang	Integrity 2021: Integrity in Social Networks and Media.	2021	https://doi.org/10.1145/3437963.3441841
Yongfeng Zhang, Min Zhang, Hanxiong Chen, Xu Chen, Xianjie Chen, Chuang Gan, Tong Sun, Xin Luna Dong	The 1st International Workshop on Machine Reasoning: International Machine Reasoning Conference (MRC 2021).	2021	https://doi.org/10.1145/3437963.3441838
Debasis Ganguly, Manisha Verma, Procheta Sen, Dipasree Pal, Gareth J. F. Jones	Overview of the Supporting and Understanding of Conversational Dialogues (SUD) Workshop.	2021	https://doi.org/10.1145/3437963.3441839
Danilo Dessì, Tanja Käser, Mirko Marras, Elvira Popescu, Harald Sack	L2D 2021: First International Workshop on Enabling Data-Driven Decisions from Learning on the Web.	2021	https://doi.org/10.1145/3437963.3441840
